{
  "$schema": "https://json-schema.org/draft/2020-12/schema",
  "$id": "openmontage/artifacts/asset_manifest",
  "title": "Asset Manifest",
  "description": "Inventory of generated/sourced assets produced by the Asset Generator.",
  "type": "object",
  "required": ["version", "assets"],
  "properties": {
    "version": { "type": "string", "const": "1.0" },
    "assets": {
      "type": "array",
      "items": {
        "type": "object",
        "required": ["id", "type", "path", "source_tool", "scene_id"],
        "properties": {
          "id": { "type": "string" },
          "type": {
            "type": "string",
            "enum": ["image", "video", "audio", "narration", "music", "sfx", "diagram", "animation", "3d_asset", "3d_world", "code_snippet", "subtitle", "font", "lut"]
          },
          "path": { "type": "string", "description": "Relative path within the pipeline project directory" },
          "source_tool": { "type": "string" },
          "scene_id": { "type": "string" },
          "prompt": { "type": "string", "description": "Generation prompt if AI-generated" },
          "seed": { "type": "integer", "description": "Seed if applicable" },
          "model": { "type": "string", "description": "Model used for generation" },
          "cost_usd": { "type": "number", "minimum": 0 },
          "duration_seconds": { "type": "number", "minimum": 0 },
          "resolution": { "type": "string" },
          "format": { "type": "string" },
          "quality_score": { "type": "number", "minimum": 0, "maximum": 1 },
          "subtype": { "type": "string", "description": "Sub-classification (e.g. 'background', 'stock', 'generated')" },
          "generation_summary": { "type": "string", "description": "Brief summary of how the asset was generated or sourced" },
          "provider": { "type": "string", "description": "Provider name (e.g. pixabay, google_imagen)" },
          "license": { "type": "string", "description": "License type (e.g. Pixabay License, CC0)" },
          "original_url": { "type": "string", "description": "Source URL if downloaded from a stock service" },
          "voice_performance": {
            "type": "object",
            "description": "Applied voice-performance contract for narration assets.",
            "properties": {
              "source_section_id": { "type": "string" },
              "delivery_cues_applied": { "type": "boolean" },
              "provider_text_used": { "type": "boolean" },
              "provider_settings": {
                "type": "object",
                "additionalProperties": true
              },
              "sample_approved": { "type": "boolean" },
              "sample_path": { "type": "string" },
              "review_notes": { "type": "string" }
            },
            "additionalProperties": false
          },
          "img2img_source": {
            "type": "string",
            "description": "Path to the init_image used for img2img generation. Required by pipelines that enforce img2img (e.g. fabric-promotion). Null/absent for non-img2img assets."
          },
          "linked_concept_id": {
            "type": ["string", "integer"],
            "description": "Identifier linking this asset to a concept/act in the brief (e.g. concept A/B/C, or 0 for fabric macro / cover base). Used by fabric-promotion and similar pipelines that tie assets to specific brief concepts."
          },
          "kind": {
            "type": "string",
            "description": "Pipeline-specific sub-classification complementing 'type' and 'subtype'. Examples for fabric-promotion: narration_wav, narration_timestamps, garment_image, garment_video, fabric_macro_video, cover_base_image."
          },
          "layer": {
            "type": "string",
            "enum": ["bg", "hero", "element", "decor"],
            "description": "VOX paper-collage layer this asset belongs to (L1 bg / L2 hero / L3 element / L4 decor). Required for vox-paper-collage pipeline."
          },
          "element_role": {
            "type": "string",
            "enum": ["full_collage", "independent_element", "multi_grid_ref", "background_texture", "composed_ref", "thumbnail"],
            "description": "Role of this asset in the A3 production unit: beat full collage, independent element PNG, multi-grid reference, background texture, composed-scene reference, or thumbnail candidate."
          },
          "derived_from": {
            "type": "string",
            "description": "Path of the image used as img2img reference when generating this asset (e.g. the beat full collage for independent elements, or the real photo for real_content restyles)."
          },
          "library_ref": {
            "type": "string",
            "description": "Path in assets/shared_library/ if this asset came from or was archived to the Global Asset Library."
          },
          "data_class": {
            "type": "string",
            "enum": ["real_data", "real_content", "creative", "css"],
            "description": "VOX paper-collage data authenticity class for this asset. real_data must trace to a real data source; real_content must trace to a real photo."
          },
          "data_source": {
            "type": "string",
            "description": "Real data source or photo source for real_data / real_content assets."
          }
        },
        "additionalProperties": false
      }
    },
    "total_cost_usd": { "type": "number", "minimum": 0 },
    "multi_grid_refs": {
      "type": "array",
      "items": { "type": "string" },
      "description": "Paths to multi-grid reference images (e.g. 2x3 composed-scene previews) for user visual approval before element splitting."
    },
    "missing_photos": {
      "type": "array",
      "items": {
        "type": "object",
        "required": ["element_id", "description", "data_class", "search_channels_attempted"],
        "properties": {
          "element_id": { "type": "string" },
          "description": { "type": "string" },
          "data_class": { "type": "string", "enum": ["real_content"] },
          "search_channels_attempted": {
            "type": "array",
            "items": { "type": "string" }
          },
          "suggested_fallback": { "type": "string" }
        },
        "additionalProperties": false
      },
      "description": "real_content elements whose real photos could not be found. Submitted to user for decision (C7) before continuing."
    },
    "timing_calibration_ref": {
      "type": "object",
      "properties": {
        "tts_timestamps_path": { "type": "string" },
        "estimated_duration_seconds": { "type": "number" },
        "actual_duration_seconds": { "type": "number" },
        "deviation_percent": { "type": "number" },
        "status": {
          "type": "string",
          "enum": ["calibrated", "exceeds_threshold", "rewind_required"]
        }
      },
      "additionalProperties": false,
      "description": "TTS timing calibration record linking assets stage to scene_plan timing update."
    },
    "metadata": { "type": "object" }
  },
  "additionalProperties": false
}
